id,text,sources
1,"The SCADS 2024 Grand Challenge aims to generate tailored daily reports for knowledge workers within the intelligence community, integrating both classified and unclassified materials.","S13,S14"
2,"The focus areas include Automatic Summarization, Recommendation Systems, and Human-Machine Interaction, with a strong emphasis on explainability and contextualization.","S16,S17"
3,"Embedding models are utilized for improving extractive summarization by analyzing sentence embeddings and vector searches.","S51,S52,S61,S62"
4,"A significant part of the challenge is addressing hallucinations in abstractive summaries using Retrieval Augmented Generation (RAG).","S72,S73"
5,"Evaluations of summarization methods are based on metrics like ROUGE scores and datasets such as MS MARCO and NeuCLIR1.","S252,S251"
6,"User feedback mechanisms are crucial for refining the TLDRs, with interfaces designed to collect and leverage input effectively.","S1064,S1065"
7,"The development of personalized summaries is tailored to analysts’ specific needs, ensuring relevance and utility.","S988,S990"
8,"Systems that integrate multiple intelligence types into cohesive narratives significantly enhance situational awareness for analysts.","S1300,S1301"
9,"The occams package's optimization algorithm has shown unparalleled efficiency in summarization tasks.","S31,S32"
10,"Preliminary user studies indicate that TLDRs can improve decision-making speed by up to 50%.","S1068,S1069"
